{
  "$schema": "http://json-schema.org/draft-07/schema#",
  "$id": "https://github.com/andrei-shtanakov/spec-runner/schemas/executor-state.schema.json",
  "title": "ExecutorState",
  "description": "Typed view of spec-runner's executor state. See docs/state-schema.md.",
  "type": "object",
  "additionalProperties": false,
  "properties": {
    "tasks": {
      "description": "Task id \u2192 state mapping",
      "type": "object",
      "additionalProperties": { "$ref": "#/definitions/TaskEntry" }
    },
    "consecutive_failures": {
      "description": "Current consecutive failure count (resets on success)",
      "type": "integer",
      "minimum": 0,
      "default": 0
    },
    "total_completed": {
      "description": "Monotonic counter of successfully completed tasks",
      "type": "integer",
      "minimum": 0,
      "default": 0
    },
    "total_failed": {
      "description": "Monotonic counter of permanently failed tasks",
      "type": "integer",
      "minimum": 0,
      "default": 0
    }
  },
  "required": ["tasks"],
  "definitions": {
    "TaskEntry": {
      "title": "TaskState",
      "description": "Per-task entry. Mirrors spec_runner.state.TaskState.",
      "type": "object",
      "additionalProperties": false,
      "properties": {
        "status": {
          "description": "Current task status",
          "type": "string",
          "enum": ["pending", "running", "success", "failed", "skipped"]
        },
        "started_at": {
          "description": "ISO 8601 start timestamp",
          "type": ["string", "null"]
        },
        "completed_at": {
          "description": "ISO 8601 completion timestamp",
          "type": ["string", "null"]
        },
        "attempts": {
          "description": "Ordered list of execution attempts",
          "type": "array",
          "items": { "$ref": "#/definitions/TaskAttempt" },
          "default": []
        }
      },
      "required": ["status"]
    },
    "TaskAttempt": {
      "title": "TaskAttempt",
      "description": "One attempt record. Mirrors spec_runner.state.TaskAttempt.",
      "type": "object",
      "additionalProperties": false,
      "properties": {
        "timestamp": {
          "description": "ISO 8601 timestamp of the attempt",
          "type": "string"
        },
        "success": {
          "description": "Whether the attempt succeeded",
          "type": "boolean"
        },
        "duration_seconds": {
          "description": "Wall-clock duration of the attempt",
          "type": "number",
          "minimum": 0
        },
        "error": {
          "description": "Error message if failed",
          "type": ["string", "null"]
        },
        "error_code": {
          "description": "Structured error classification (ErrorCode)",
          "type": ["string", "null"],
          "enum": [
            "TIMEOUT",
            "RATE_LIMIT",
            "TEST_FAILURE",
            "LINT_FAILURE",
            "TASK_FAILED",
            "TASK_BLOCKED",
            "HOOK_FAILURE",
            "INFRASTRUCTURE",
            "BUDGET_EXCEEDED",
            "REVIEW_REJECTED",
            "INTERRUPTED",
            "UNKNOWN",
            null
          ]
        },
        "claude_output": {
          "description": "Captured Claude CLI output (experimental \u2014 format may change)",
          "type": ["string", "null"]
        },
        "input_tokens": {
          "description": "Prompt tokens; null if unavailable",
          "type": ["integer", "null"],
          "minimum": 0
        },
        "output_tokens": {
          "description": "Completion tokens; null if unavailable",
          "type": ["integer", "null"],
          "minimum": 0
        },
        "cost_usd": {
          "description": "Attempt cost in USD",
          "type": ["number", "null"],
          "minimum": 0
        },
        "review_status": {
          "description": "Last review verdict (ReviewVerdict). not_run/error added in #138: a review that produced no verdict, and one whose machinery failed — neither may be read as passed",
          "type": ["string", "null"],
          "enum": ["passed", "fixed", "failed", "skipped", "rejected", "not_run", "error", null]
        },
        "review_findings": {
          "description": "Free-text review notes (experimental)",
          "type": ["string", "null"]
        },
        "error_kind": {
          "description": "Classified failure kind (experimental, added v2.3.0; widened in #301 to the kinds the writer actually produces — the first five come from errors.classify, the rest from the execution path. 'policy'/'instrument'/'budget' are RefusalKind's own values: a gate said no, a gate could not answer, there was no money left to find out. The single source is errors.ERROR_KINDS, and a test compares this list to it)",
          "type": ["string", "null"],
          "enum": [
            "rate_limit",
            "auth",
            "network",
            "cli_error",
            "unknown",
            "api_error",
            "blocked",
            "policy",
            "instrument",
            "budget",
            "hook_failure",
            "harness_guard",
            "timeout",
            "interrupted",
            "internal_error",
            null
          ]
        },
        "error_stage": {
          "description": "Sub-stage when the failure occurred (experimental, added v2.3.0). 'exec' replaced 'codex' as the agent-execution stage name in v2.13; 'codex' remains valid for rows written by <=2.12. 'verify' (v2.36.0, #367 BEH-30) is the live verify-first run, distinct from 'tests' — the post-done stage that judges the candidate tree after the implementation pass.",
          "type": ["string", "null"],
          "enum": [
            "sync_deps",
            "branch",
            "verify",
            "exec",
            "codex",
            "parse",
            "tests",
            "lint",
            "commit",
            "merge",
            "review",
            null
          ]
        },
        "run_id": {
          "description": "run_id of the invocation that recorded the attempt (added 4.5.0, #480); null for rows written before the contract.",
          "type": ["string", "null"]
        }
      },
      "required": ["timestamp", "success", "duration_seconds"]
    }
  }
}
